query
SELECT oid, relname, reltablespace, relkind FROM pg_class WHERE reltablespace = 0 ORDER BY oid
----
oid	relname	reltablespace	relkind
101	pg_aggregate	0	r
102	pg_am	0	r
103	pg_amop	0	r
104	pg_amproc	0	r
105	pg_attrdef	0	r
106	pg_attribute	0	r
107	pg_authid	0	r
108	pg_auth_members	0	r
109	pg_cast	0	r
110	pg_class	0	r
111	pg_collation	0	r
112	pg_constraint	0	r
113	pg_conversion	0	r
114	pg_database	0	r
115	pg_db_role_setting	0	r
116	pg_default_acl	0	r
117	pg_depend	0	r
118	pg_description	0	r
119	pg_enum	0	r
120	pg_event_trigger	0	r
121	pg_extension	0	r
122	pg_foreign_data_wrapper	0	r
123	pg_foreign_server	0	r
124	pg_foreign_table	0	r
125	pg_index	0	r
126	pg_inherits	0	r
127	pg_init_privs	0	r
128	pg_language	0	r
129	pg_largeobject	0	r
130	pg_largeobject_metadata	0	r
131	pg_namespace	0	r
132	pg_opclass	0	r
133	pg_operator	0	r
134	pg_opfamily	0	r
135	pg_parameter_acl	0	r
136	pg_partitioned_table	0	r
137	pg_policy	0	r
138	pg_proc	0	r
139	pg_publication	0	r
140	pg_publication_namespace	0	r
141	pg_publication_rel	0	r
142	pg_range	0	r
143	pg_replication_origin	0	r
144	pg_rewrite	0	r
145	pg_seclabel	0	r
146	pg_sequence	0	r
147	pg_shdepend	0	r
148	pg_shdescription	0	r
149	pg_shseclabel	0	r
150	pg_statistic	0	r
151	pg_statistic_ext	0	r
152	pg_statistic_ext_data	0	r
153	pg_subscription	0	r
154	pg_subscription_rel	0	r
155	pg_tablespace	0	r
156	pg_transform	0	r
157	pg_trigger	0	r
158	pg_ts_config	0	r
159	pg_ts_config_map	0	r
160	pg_ts_dict	0	r
161	pg_ts_parser	0	r
162	pg_ts_template	0	r
163	pg_type	0	r
164	pg_user_mapping	0	r
165	sql_features	0	r
166	sql_implementation_info	0	r
167	sql_parts	0	r
168	sql_sizing	0	r
999997	sdb_stat_progress	0	r
999998	sdb_show_all_settings	0	r
999999	sdb_log	0	r


statement ok
CREATE TABLE t(r text)


query
SELECT relname FROM pg_class WHERE relname = 't'
----
relname
t

query
SELECT relname, reloptions FROM pg_class WHERE reloptions <> ARRAY[]::varchar[];
----
relname	reloptions


statement count 3
INSERT INTO t VALUES ('a'), ('b'), ('c');


statement count 3
INSERT INTO t VALUES ('a'), ('b'), ('c');


query
SELECT relname, reltuples FROM pg_class WHERE relname = 't';
----
relname	reltuples
t	6


statement count 2
UPDATE t SET r = 'aa' WHERE r = 'a';


query
SELECT relname, reltuples FROM pg_class WHERE relname = 't';
----
relname	reltuples
t	6


statement count 2
DELETE FROM t WHERE r = 'aa';


query
SELECT relname, reltuples FROM pg_class WHERE relname = 't';
----
relname	reltuples
t	4
