hash-threshold 100

statement ok
CREATE TABLE foo (a INTEGER PRIMARY KEY, b VARCHAR, c VARCHAR);

statement ok
INSERT INTO foo values (1, 'quick brown fox jumps over lazy dog', 'value a');

statement ok
CREATE TEXT SEARCH DICTIONARY test_english(
    template = 'text',
    locale = 'en_US.UTF-8',
    case = 'none',
    stemming = false,
    accent = false,
    frequency = true,
    position = true
);

statement ok
CREATE INDEX foo_idx ON foo USING inverted(a, b test_english, c test_english);

query
SELECT a, b, c FROM foo_idx WHERE b @@ ts_phrase('over lazy dog');
----
a	b	c
1	quick brown fox jumps over lazy dog	value a

statement ok
INSERT INTO foo values (2, 'quick red fox jumps over lazy dog', 'value a');

statement ok
VACUUM (UPDATE_INDEXES) foo;

query
SELECT a, b FROM foo_idx WHERE b @@ ts_phrase('over lazy dog') ORDER BY a;
----
a	b
1	quick brown fox jumps over lazy dog
2	quick red fox jumps over lazy dog

statement ok
UPDATE foo SET c = 'value abc' WHERE a = 1;

statement ok
VACUUM (UPDATE_INDEXES) foo;

query
SELECT a, b, c FROM foo_idx WHERE c @@ ts_phrase('value abc') AND b @@ ts_phrase('over lazy dog');
----
a	b	c
1	quick brown fox jumps over lazy dog	value abc

statement ok
INSERT INTO foo values (3, 'quick red fox jumps over big dog', 'value a');

statement ok
INSERT INTO foo values (4, 'quick brown fox jumps over big dog', 'value b');

statement ok
VACUUM (UPDATE_INDEXES) foo;

query
SELECT a, b FROM foo_idx WHERE b @@ ts_phrase('over big dog') OR b @@ ts_phrase('red fox') ORDER BY a;
----
a	b
2	quick red fox jumps over lazy dog
3	quick red fox jumps over big dog
4	quick brown fox jumps over big dog

query
SELECT a, b FROM foo_idx WHERE b @@ ts_phrase('over big dog') OR a = 1 ORDER BY a;
----
a	b
1	quick brown fox jumps over lazy dog
3	quick red fox jumps over big dog
4	quick brown fox jumps over big dog

query
SELECT a, b, c FROM foo_idx WHERE c @@ ts_phrase('value b') AND b @@ ts_phrase('over big dog');
----
a	b	c
4	quick brown fox jumps over big dog	value b

statement ok
INSERT INTO foo values (5, 'quick brown lazy fox runs over big dog', 'value c');

statement ok
INSERT INTO foo values (6, 'quick fox over big dog', 'value c');

statement ok
VACUUM (UPDATE_INDEXES) foo;

# Exact gap: 1 word between 'quick' and 'fox' -- matches rows with 'quick brown fox' and 'quick red fox'
query
SELECT a, b FROM foo_idx WHERE b @@ ts_phrase('quick', 1, 'fox') ORDER BY a;
----
a	b
1	quick brown fox jumps over lazy dog
2	quick red fox jumps over lazy dog
3	quick red fox jumps over big dog
4	quick brown fox jumps over big dog

# Exact gap: 2 words between 'quick' and 'fox' -- matches only row 5 ('quick brown lazy fox')
query
SELECT a, b FROM foo_idx WHERE b @@ ts_phrase('quick', 2, 'fox') ORDER BY a;
----
a	b
5	quick brown lazy fox runs over big dog

# Exact gap: 0 words between (adjacent) -- matches only row 6 ('quick fox')
query
SELECT a, b FROM foo_idx WHERE b @@ ts_phrase('quick', 0, 'fox') ORDER BY a;
----
a	b
6	quick fox over big dog

# Range gap [0,1]: 0 or 1 words between 'quick' and 'fox'
query
SELECT a, b FROM foo_idx WHERE b @@ ts_phrase('quick', ARRAY[0,1], 'fox') ORDER BY a;
----
a	b
1	quick brown fox jumps over lazy dog
2	quick red fox jumps over lazy dog
3	quick red fox jumps over big dog
4	quick brown fox jumps over big dog
6	quick fox over big dog

# Range gap [1,2]: 1 or 2 words between 'quick' and 'fox'
query
SELECT a, b FROM foo_idx WHERE b @@ ts_phrase('quick', ARRAY[1,2], 'fox') ORDER BY a;
----
a	b
1	quick brown fox jumps over lazy dog
2	quick red fox jumps over lazy dog
3	quick red fox jumps over big dog
4	quick brown fox jumps over big dog
5	quick brown lazy fox runs over big dog

# Range gap with bracket-literal syntax [1,2] -- also binds to LIST,
# same as ARRAY[1,2] above.
query
SELECT a, b FROM foo_idx WHERE b @@ ts_phrase('quick', [1,2], 'fox') ORDER BY a;
----
a	b
1	quick brown fox jumps over lazy dog
2	quick red fox jumps over lazy dog
3	quick red fox jumps over big dog
4	quick brown fox jumps over big dog
5	quick brown lazy fox runs over big dog

# Range gap with explicit fixed-size ARRAY cast -- exercises the ARRAY
# branch of FromPhrase (unadorned ARRAY[..] / [..] bind to LIST, only an
# explicit INTEGER[n] cast produces a fixed-size ARRAY value).
query
SELECT a, b FROM foo_idx WHERE b @@ ts_phrase('quick', [1,2]::INTEGER[2], 'fox') ORDER BY a;
----
a	b
1	quick brown fox jumps over lazy dog
2	quick red fox jumps over lazy dog
3	quick red fox jumps over big dog
4	quick brown fox jumps over big dog
5	quick brown lazy fox runs over big dog

# Multi-token pattern with gap: 'quick brown' then 1 word then 'fox' -- only row 5 has 'brown lazy fox'
query
SELECT a, b FROM foo_idx WHERE b @@ ts_phrase('quick brown', 1, 'fox') ORDER BY a;
----
a	b
5	quick brown lazy fox runs over big dog

# Multiple gaps: 'quick' +1 word+ 'fox' +3 words+ 'dog'
query
SELECT a, b FROM foo_idx WHERE b @@ ts_phrase('quick', 1, 'fox', 3, 'dog') ORDER BY a;
----
a	b
1	quick brown fox jumps over lazy dog
2	quick red fox jumps over lazy dog
3	quick red fox jumps over big dog
4	quick brown fox jumps over big dog

# Error: leading text pattern tokenizes to nothing (empty string) so the
# following integer gap has no preceding text -- covers the opts->empty()
# check in the integer gap branch of FromPhrase.
query error ts_phrase gap at argument 1 must be preceded by a text pattern
SELECT a FROM foo_idx WHERE b @@ ts_phrase('', 1, 'fox');


# Same as above but via a range gap -- covers the opts->empty() check
# in the LIST/ARRAY gap branch of FromPhrase.
query error ts_phrase gap at argument 1 must be preceded by a text pattern
SELECT a FROM foo_idx WHERE b @@ ts_phrase('', ARRAY[1,2], 'fox');


# Error: gap at end with no following text pattern
query error ts_phrase ends with a gap; a text pattern must follow each gap
SELECT a FROM foo_idx WHERE b @@ ts_phrase('quick', 1);


# Error: two consecutive gaps
query error ts_phrase has consecutive gaps at argument 2
SELECT a FROM foo_idx WHERE b @@ ts_phrase('quick', 1, 2, 'fox');


# Error: range gap with min > max
query error ts_phrase interval gap must satisfy 0 <= min <= max, got \[3, 1\] \(argument 1\)
SELECT a FROM foo_idx WHERE b @@ ts_phrase('quick', ARRAY[3,1], 'fox');


statement ok
DROP TABLE foo;

control substitution on

statement ok
CREATE TABLE vedernikoff (a INTEGER PRIMARY KEY, b VARCHAR, c VARCHAR);

statement ok
INSERT INTO vedernikoff values (1, 'pudge goes mid every game', 'babsky');

statement ok
INSERT INTO vedernikoff values (2, 'anchin-chan reads manga all day', 'babsky');

statement ok
INSERT INTO vedernikoff values (3, 'anchin-chan watches anime at night', 'tuetue');

statement ok
INSERT INTO vedernikoff values (4, 'pudge goes bot every game', 'gayazov');

statement ok
CREATE INDEX vedernikoff_idx ON vedernikoff USING inverted(a, b test_english, c test_english);


query
SELECT COUNT(1) FROM vedernikoff_idx WHERE b @@ ts_phrase('pudge') AND b @@ ts_phrase('game');
----
count
2


query
EXPLAIN SELECT COUNT(*) FROM vedernikoff_idx WHERE b @@ ts_phrase('pudge') AND b @@ ts_phrase('game');
----
QUERY PLAN
┌───────────────────────────┐
│    UNGROUPED_AGGREGATE    │
│    ────────────────────   │
│        Aggregates:        │
│        count_star()       │
│                           │
│           ~1 row          │
└─────────────┬─────────────┘
┌─────────────┴─────────────┐
│      IRESEARCH_COUNT      │
│    ────────────────────   │
│           Index:          │
│      vedernikoff_idx      │
│                           │
│      Lookup: rocksdb      │
│                           │
│          Filter:          │
│  AND[PHRASE[b(string) =   │
│  <Term:pudge(0, 0); >] && │
│  PHRASE[b(string) = <Term │
│      :game(0, 0); >]]     │
│                           │
│          Output:          │
│       row-count only      │
│                           │
│          ~4 rows          │
└───────────────────────────┘


query
SELECT a, b FROM vedernikoff_idx WHERE b @@ ts_phrase('every game') OR b @@ ts_phrase('anchin-chan') ORDER BY a;
----
a	b
1	pudge goes mid every game
2	anchin-chan reads manga all day
3	anchin-chan watches anime at night
4	pudge goes bot every game


query
SELECT a, b FROM vedernikoff_idx WHERE b @@ ts_phrase('every game') OR a = 2 ORDER BY a;
----
a	b
1	pudge goes mid every game
2	anchin-chan reads manga all day
4	pudge goes bot every game


query
SELECT a, b, c FROM vedernikoff_idx WHERE c @@ ts_phrase('gayazov') AND b @@ ts_phrase('every game');
----
a	b	c
4	pudge goes bot every game	gayazov


statement ok
UPDATE vedernikoff SET c = 'deadinside' WHERE a = 3;


statement ok
VACUUM (UPDATE_INDEXES) vedernikoff;


query
SELECT a, b, c FROM vedernikoff_idx WHERE c @@ ts_phrase('deadinside') AND b @@ ts_phrase('watches anime');
----
a	b	c
3	anchin-chan watches anime at night	deadinside


statement ok
DROP TABLE vedernikoff;


statement ok
CREATE TABLE biksalen_memes (a INTEGER PRIMARY KEY, b TEXT, c TEXT);


statement ok
INSERT INTO biksalen_memes VALUES
  (1, 'pudge goes mid every game', 'clickclack university'),
  (2, 'anchin-chan reads manga all day', 'clickclack university'),
  (3, 'vedernikoff carries team again', 'deadinside academy');


query
EXPLAIN CREATE INDEX donsimon_idx ON biksalen_memes USING inverted(b, c);
----
QUERY PLAN
┌───────────────────────────┐
│         EXTENSION         │
└─────────────┬─────────────┘
┌─────────────┴─────────────┐
│   ROCKSDB_TABLE_FULLSCAN  │
│    ────────────────────   │
│   Table: biksalen_memes   │
│                           │
│        Projections:       │
│             a             │
│             b             │
│             c             │
│                           │
│          ~3 rows          │
└───────────────────────────┘


query
EXPLAIN CREATE INDEX donsimon_idx ON biksalen_memes USING inverted(b, c);
----
QUERY PLAN
┌───────────────────────────┐
│         EXTENSION         │
└─────────────┬─────────────┘
┌─────────────┴─────────────┐
│   ROCKSDB_TABLE_FULLSCAN  │
│    ────────────────────   │
│   Table: biksalen_memes   │
│                           │
│        Projections:       │
│             a             │
│             b             │
│             c             │
│                           │
│          ~3 rows          │
└───────────────────────────┘


query
EXPLAIN CREATE INDEX donsimon_idx ON biksalen_memes USING inverted(b, c);
----
QUERY PLAN
┌───────────────────────────┐
│         EXTENSION         │
└─────────────┬─────────────┘
┌─────────────┴─────────────┐
│   ROCKSDB_TABLE_FULLSCAN  │
│    ────────────────────   │
│   Table: biksalen_memes   │
│                           │
│        Projections:       │
│             a             │
│             b             │
│             c             │
│                           │
│          ~3 rows          │
└───────────────────────────┘


query
EXPLAIN ANALYZE CREATE INDEX donsimon_idx ON biksalen_memes USING inverted(b test_english, c test_english);
----
QUERY PLAN
┌─────────────────────────────────────┐
│┌───────────────────────────────────┐│
││    Query Profiling Information    ││
│└───────────────────────────────────┘│
└─────────────────────────────────────┘
EXPLAIN ANALYZE CREATE INDEX donsimon_idx ON biksalen_memes USING inverted(b test_english, c test_english);
┌────────────────────────────────────────────────┐
│┌──────────────────────────────────────────────┐│
││              Total Time: <slt:ignore>        ││
│└──────────────────────────────────────────────┘│
└────────────────────────────────────────────────┘
┌───────────────────────────┐
│           QUERY           │
└─────────────┬─────────────┘
┌─────────────┴─────────────┐
│      EXPLAIN_ANALYZE      │
│    ────────────────────   │
│                           │
│           0 rows          │
│           <slt:ignore>    │
└─────────────┬─────────────┘
┌─────────────┴─────────────┐
│         EXTENSION         │
│    ────────────────────   │
│                           │
│           1 row           │
│           <slt:ignore>    │
└─────────────┬─────────────┘
┌─────────────┴─────────────┐
│         TABLE_SCAN        │
│    ────────────────────   │
│   Table: biksalen_memes   │
│                           │
│        Projections:       │
│             a             │
│             b             │
│             c             │
│                           │
│                           │
│                           │
│           3 rows          │
│           <slt:ignore>    │
└───────────────────────────┘


# EXPLAIN ANALYZE must actually create the index
query
SELECT a, b FROM donsimon_idx WHERE b @@ ts_phrase('every game') ORDER BY a;
----
a	b
1	pudge goes mid every game

query
SELECT a, b, c FROM donsimon_idx WHERE c @@ ts_phrase('clickclack university') ORDER BY a;
----
a	b	c
1	pudge goes mid every game	clickclack university
2	anchin-chan reads manga all day	clickclack university

query
SELECT a, b, c FROM donsimon_idx WHERE c @@ ts_phrase('deadinside academy') AND b @@ ts_phrase('vedernikoff') ORDER BY a;
----
a	b	c
3	vedernikoff carries team again	deadinside academy

query
SELECT a, b FROM donsimon_idx WHERE b @@ ts_phrase('every game') OR b @@ ts_phrase('mass effect') ORDER BY a;
----
a	b
1	pudge goes mid every game

query
SELECT * FROM donsimon_idx;
----
a	b	c
1	pudge goes mid every game	clickclack university
2	anchin-chan reads manga all day	clickclack university
3	vedernikoff carries team again	deadinside academy



# index backfill from external (file) table

statement ok
CREATE TABLE babsky_src (a INTEGER PRIMARY KEY, b TEXT, c TEXT);

statement ok
INSERT INTO babsky_src VALUES
  (1, 'pudge goes mid every game', 'clickclack university'),
  (2, 'anchin-chan reads manga all day', 'clickclack university'),
  (3, 'vedernikoff carries team again', 'deadinside academy'),
  (4, 'gayazov plays mass effect', 'deadinside academy'),
  (5, 'krivda writes sql at night', 'clickclack university');

statement count 5
COPY babsky_src TO '/tmp/${__DATABASE__}_babsky_memes.parquet' (FORMAT PARQUET);

statement ok
CREATE VIEW babsky_ext AS
  SELECT * FROM read_parquet('/tmp/${__DATABASE__}_babsky_memes.parquet');

statement ok
CREATE INDEX babsky_ext_idx ON babsky_ext USING inverted(a, b test_english, c test_english);

query
SELECT a, b FROM babsky_ext_idx WHERE b @@ ts_phrase('pudge goes') ORDER BY a;
----
a	b
1	pudge goes mid every game

query
SELECT a, b FROM babsky_ext_idx WHERE b @@ ts_phrase('anchin-chan') ORDER BY a;
----
a	b
2	anchin-chan reads manga all day

query
SELECT a, b, c FROM babsky_ext_idx WHERE c @@ ts_phrase('clickclack university') ORDER BY a;
----
a	b	c
1	pudge goes mid every game	clickclack university
2	anchin-chan reads manga all day	clickclack university
5	krivda writes sql at night	clickclack university

query
SELECT a, b, c FROM babsky_ext_idx WHERE c @@ ts_phrase('deadinside academy') AND b @@ ts_phrase('vedernikoff') ORDER BY a;
----
a	b	c
3	vedernikoff carries team again	deadinside academy

query
SELECT a, b FROM babsky_ext_idx WHERE b @@ ts_phrase('every game') OR b @@ ts_phrase('mass effect') ORDER BY a;
----
a	b
1	pudge goes mid every game
4	gayazov plays mass effect

query
SELECT * FROM babsky_ext_idx;
----
a	b	c
1	pudge goes mid every game	clickclack university
2	anchin-chan reads manga all day	clickclack university
3	vedernikoff carries team again	deadinside academy
4	gayazov plays mass effect	deadinside academy
5	krivda writes sql at night	clickclack university

statement ok
DROP VIEW babsky_ext;

statement ok
DROP TABLE babsky_src;


# index backfill from external (text/csv) table

statement ok
CREATE TABLE text_idx_src (a INTEGER PRIMARY KEY, b TEXT, c TEXT);

statement ok
INSERT INTO text_idx_src VALUES
  (1, 'pudge goes mid every game', 'clickclack university'),
  (2, 'anchin-chan reads manga all day', 'clickclack university'),
  (3, 'vedernikoff carries team again', 'deadinside academy'),
  (4, 'gayazov plays mass effect', 'deadinside academy'),
  (5, 'krivda writes sql at night', 'clickclack university');

statement count 5
COPY text_idx_src TO '/tmp/${__DATABASE__}_text_idx_memes.csv';

statement ok
CREATE VIEW text_idx_ext AS
  SELECT * FROM read_csv('/tmp/${__DATABASE__}_text_idx_memes.csv');

statement ok
CREATE INDEX text_idx_ext_idx ON text_idx_ext USING inverted(a, b test_english, c test_english);

query
SELECT a, b FROM text_idx_ext_idx WHERE b @@ ts_phrase('pudge goes') ORDER BY a;
----
a	b
1	pudge goes mid every game

query
SELECT a, b FROM text_idx_ext_idx WHERE b @@ ts_phrase('anchin-chan') ORDER BY a;
----
a	b
2	anchin-chan reads manga all day

query
SELECT a, b, c FROM text_idx_ext_idx WHERE c @@ ts_phrase('clickclack university') ORDER BY a;
----
a	b	c
1	pudge goes mid every game	clickclack university
2	anchin-chan reads manga all day	clickclack university
5	krivda writes sql at night	clickclack university

query
SELECT a, b, c FROM text_idx_ext_idx WHERE c @@ ts_phrase('deadinside academy') AND b @@ ts_phrase('vedernikoff') ORDER BY a;
----
a	b	c
3	vedernikoff carries team again	deadinside academy

query
SELECT a, b FROM text_idx_ext_idx WHERE b @@ ts_phrase('every game') OR b @@ ts_phrase('mass effect') ORDER BY a;
----
a	b
1	pudge goes mid every game
4	gayazov plays mass effect

query
SELECT * FROM text_idx_ext_idx;
----
a	b	c
1	pudge goes mid every game	clickclack university
2	anchin-chan reads manga all day	clickclack university
3	vedernikoff carries team again	deadinside academy
4	gayazov plays mass effect	deadinside academy
5	krivda writes sql at night	clickclack university

statement ok
DROP VIEW text_idx_ext;

statement ok
DROP TABLE text_idx_src;


# BM25 scoring on external (parquet) table

statement ok
CREATE TABLE score_parquet_src (a INTEGER PRIMARY KEY, b TEXT);

statement ok
INSERT INTO score_parquet_src VALUES
  (1, 'the quick brown fox jumps over the lazy dog'),
  (2, 'the quick fox'),
  (3, 'the lazy dog');

statement count 3
COPY score_parquet_src TO '/tmp/${__DATABASE__}_score_parquet.parquet' (FORMAT PARQUET);

statement ok
CREATE VIEW score_parquet_ext AS
  SELECT * FROM read_parquet('/tmp/${__DATABASE__}_score_parquet.parquet');

statement ok
CREATE TEXT SEARCH DICTIONARY score_en(
    template = 'text',
    locale = 'en_US.UTF-8',
    case = 'none',
    stemming = false,
    accent = false,
    frequency = true,
    position = true,
    norm = true
);

statement ok
CREATE INDEX score_parquet_idx ON score_parquet_ext USING inverted(a, b score_en);

onlyif serenedb
query
EXPLAIN SELECT a, BM25(score_parquet_idx.tableoid) > 0 AS has_score FROM score_parquet_idx WHERE b @@ ts_phrase('fox') ORDER BY a;
----
QUERY PLAN
┌───────────────────────────┐
│          ORDER_BY         │
│    ────────────────────   │
│  score_parquet_idx.a ASC  │
│                           │
│          ~0 rows          │
└─────────────┬─────────────┘
┌─────────────┴─────────────┐
│         PROJECTION        │
│    ────────────────────   │
│             a             │
│         has_score         │
│                           │
│           ~1 row          │
└─────────────┬─────────────┘
┌─────────────┴─────────────┐
│       IRESEARCH_SCAN      │
│    ────────────────────   │
│           Index:          │
│     score_parquet_idx     │
│                           │
│      Lookup: parquet      │
│                           │
│          Filter:          │
│  AND[PHRASE[b(string) =   │
│    <Term:fox(0, 0); >]]   │
│                           │
│           Score:          │
│    bm25(k1=1.2, b=0.75)   │
│                           │
│        Projections:       │
│             a             │
│  sdb_inverted_index_score │
│                           │
│          ~3 rows          │
└───────────────────────────┘


query
SELECT a, BM25(score_parquet_idx.tableoid) > 0 AS has_score FROM score_parquet_idx WHERE b @@ ts_phrase('fox') ORDER BY a;
----
a	has_score
1	t
2	t

query
SELECT a FROM score_parquet_idx WHERE b @@ ts_phrase('fox') ORDER BY BM25(score_parquet_idx.tableoid) DESC, a;
----
a
2
1

statement ok
DROP VIEW score_parquet_ext;

statement ok
DROP TABLE score_parquet_src;


# BM25 scoring on external (text/csv) table

statement ok
CREATE TABLE score_text_src (a INTEGER PRIMARY KEY, b TEXT);

statement ok
INSERT INTO score_text_src VALUES
  (1, 'the quick brown fox jumps over the lazy dog'),
  (2, 'the quick fox'),
  (3, 'the lazy dog');

statement count 3
COPY score_text_src TO '/tmp/${__DATABASE__}_score_text.csv';

statement ok
CREATE VIEW score_text_ext AS
  SELECT * FROM read_csv('/tmp/${__DATABASE__}_score_text.csv');

statement ok
CREATE INDEX score_text_idx ON score_text_ext USING inverted(a, b score_en);

query
SELECT a, BM25(score_text_idx.tableoid) > 0 AS has_score FROM score_text_idx WHERE b @@ ts_phrase('fox') ORDER BY a;
----
a	has_score
1	t
2	t

query
SELECT a FROM score_text_idx WHERE b @@ ts_phrase('fox') ORDER BY BM25(score_text_idx.tableoid) DESC, a;
----
a
2
1

statement ok
DROP VIEW score_text_ext;

statement ok
DROP TABLE score_text_src;


# Multi-segment scoring: insert+vacuum then insert again (unsorted keys across segments)

statement ok
CREATE TABLE multi_seg (a INTEGER PRIMARY KEY, b TEXT);

statement ok
INSERT INTO multi_seg VALUES (1, 'alpha fox'), (2, 'beta fox');

statement ok
CREATE INDEX multi_seg_idx ON multi_seg USING inverted(a, b score_en);

statement ok
VACUUM (UPDATE_INDEXES) multi_seg;

statement ok
INSERT INTO multi_seg VALUES (3, 'gamma fox'), (4, 'delta fox');

statement ok
VACUUM (UPDATE_INDEXES) multi_seg;

query
SELECT a, BM25(multi_seg_idx.tableoid) > 0 AS has_score FROM multi_seg_idx WHERE b @@ ts_phrase('fox') ORDER BY a;
----
a	has_score
1	t
2	t
3	t
4	t

query
SELECT a FROM multi_seg_idx WHERE b @@ ts_phrase('fox') ORDER BY BM25(multi_seg_idx.tableoid) DESC, a;
----
a
1
2
3
4

statement ok
DROP TABLE multi_seg;


statement ok
CREATE TABLE dense_pq_src (a INTEGER PRIMARY KEY, b TEXT, c TEXT);

statement ok
INSERT INTO dense_pq_src VALUES
  (1, 'common word alpha here', 'group east side'),
  (2, 'common word beta here', 'group west side'),
  (3, 'common word gamma here', 'group east side'),
  (4, 'common word delta here', 'group west side'),
  (5, 'common word epsilon here', 'group east side'),
  (6, 'common word zeta here', 'group west side'),
  (7, 'common word eta here', 'group east side'),
  (8, 'common word theta here', 'group west side');

statement count 8
COPY dense_pq_src TO '/tmp/${__DATABASE__}_dense_pq.parquet' (FORMAT PARQUET);

statement ok
CREATE VIEW dense_pq_ext AS
  SELECT * FROM read_parquet('/tmp/${__DATABASE__}_dense_pq.parquet');

statement ok
CREATE INDEX dense_pq_idx ON dense_pq_ext USING inverted(a, b test_english, c test_english);

query
SELECT a, b FROM dense_pq_idx WHERE b @@ ts_phrase('common word') ORDER BY a;
----
a	b
1	common word alpha here
2	common word beta here
3	common word gamma here
4	common word delta here
5	common word epsilon here
6	common word zeta here
7	common word eta here
8	common word theta here

query
SELECT a, b, c FROM dense_pq_idx WHERE b @@ ts_phrase('here') ORDER BY a;
----
a	b	c
1	common word alpha here	group east side
2	common word beta here	group west side
3	common word gamma here	group east side
4	common word delta here	group west side
5	common word epsilon here	group east side
6	common word zeta here	group west side
7	common word eta here	group east side
8	common word theta here	group west side

query
SELECT * FROM dense_pq_idx WHERE b @@ ts_phrase('common') ORDER BY a;
----
a	b	c
1	common word alpha here	group east side
2	common word beta here	group west side
3	common word gamma here	group east side
4	common word delta here	group west side
5	common word epsilon here	group east side
6	common word zeta here	group west side
7	common word eta here	group east side
8	common word theta here	group west side

query
SELECT a FROM dense_pq_idx WHERE b @@ ts_phrase('common word') ORDER BY a;
----
a
1
2
3
4
5
6
7
8

query
SELECT a, c FROM dense_pq_idx WHERE c @@ ts_phrase('group east side') ORDER BY a;
----
a	c
1	group east side
3	group east side
5	group east side
7	group east side

query
SELECT a, b FROM dense_pq_idx WHERE b @@ ts_phrase('theta') ORDER BY a;
----
a	b
8	common word theta here

query
SELECT a, b, c FROM dense_pq_idx WHERE b @@ ts_phrase('common') AND c @@ ts_phrase('group west side') ORDER BY a;
----
a	b	c
2	common word beta here	group west side
4	common word delta here	group west side
6	common word zeta here	group west side
8	common word theta here	group west side

query
SELECT a, b FROM dense_pq_idx WHERE b @@ ts_phrase('alpha') OR b @@ ts_phrase('theta') ORDER BY a;
----
a	b
1	common word alpha here
8	common word theta here

query
SELECT a, BM25(dense_pq_idx.tableoid) > 0 AS has_score FROM dense_pq_idx WHERE b @@ ts_phrase('common word') ORDER BY a;
----
a	has_score
1	t
2	t
3	t
4	t
5	t
6	t
7	t
8	t

statement ok
DROP VIEW dense_pq_ext;

statement ok
DROP TABLE dense_pq_src;


statement ok
CREATE TABLE dense_csv_src (a INTEGER PRIMARY KEY, b TEXT, c TEXT);

statement ok
INSERT INTO dense_csv_src VALUES
  (1, 'shared term alpha info', 'dept red color'),
  (2, 'shared term beta info', 'dept blue color'),
  (3, 'shared term gamma info', 'dept red color'),
  (4, 'shared term delta info', 'dept blue color'),
  (5, 'shared term epsilon info', 'dept red color');

statement count 5
COPY dense_csv_src TO '/tmp/${__DATABASE__}_dense_csv.csv';

statement ok
CREATE VIEW dense_csv_ext AS
  SELECT * FROM read_csv('/tmp/${__DATABASE__}_dense_csv.csv');


query
EXPLAIN CREATE INDEX dense_csv_idx ON dense_csv_ext USING inverted(a, b test_english, c test_english);
----
QUERY PLAN
┌───────────────────────────┐
│         EXTENSION         │
└─────────────┬─────────────┘
┌─────────────┴─────────────┐
│          READ_CSV         │
│    ────────────────────   │
│     Function: READ_CSV    │
│                           │
│        Projections:       │
│             a             │
│             b             │
│             c             │
│                           │
│          ~13 rows         │
└───────────────────────────┘


statement ok
CREATE INDEX dense_csv_idx ON dense_csv_ext USING inverted(a, b test_english, c test_english);

query
EXPLAIN SELECT a, b FROM dense_csv_idx WHERE b @@ ts_phrase('shared term') ORDER BY a;
----
QUERY PLAN
┌───────────────────────────┐
│          ORDER_BY         │
│    ────────────────────   │
│    dense_csv_idx.a ASC    │
│                           │
│          ~0 rows          │
└─────────────┬─────────────┘
┌─────────────┴─────────────┐
│         PROJECTION        │
│    ────────────────────   │
│             a             │
│             b             │
│                           │
│           ~1 row          │
└─────────────┬─────────────┘
┌─────────────┴─────────────┐
│       IRESEARCH_SCAN      │
│    ────────────────────   │
│    Index: dense_csv_idx   │
│        Lookup: csv        │
│                           │
│          Filter:          │
│  AND[PHRASE[b(string) =   │
│  <Term:shared(0, 0); Term │
│      :term(1, 1); >]]     │
│                           │
│        Projections:       │
│             b             │
│             a             │
│                           │
│          ~5 rows          │
└───────────────────────────┘


query
SELECT a, b FROM dense_csv_idx WHERE b @@ ts_phrase('shared term') ORDER BY a;
----
a	b
1	shared term alpha info
2	shared term beta info
3	shared term gamma info
4	shared term delta info
5	shared term epsilon info

query
SELECT a, b, c FROM dense_csv_idx WHERE b @@ ts_phrase('info') ORDER BY a;
----
a	b	c
1	shared term alpha info	dept red color
2	shared term beta info	dept blue color
3	shared term gamma info	dept red color
4	shared term delta info	dept blue color
5	shared term epsilon info	dept red color

query
SELECT a, c FROM dense_csv_idx WHERE c @@ ts_phrase('dept red color') ORDER BY a;
----
a	c
1	dept red color
3	dept red color
5	dept red color

query
SELECT a, c FROM dense_csv_idx WHERE c @@ ts_phrase('dept blue color') ORDER BY a;
----
a	c
2	dept blue color
4	dept blue color

statement ok
DROP VIEW dense_csv_ext;

statement ok
DROP TABLE dense_csv_src;


statement ok
CREATE TABLE vedernikoff_src (a INTEGER PRIMARY KEY, b TEXT, c TEXT);

statement ok
INSERT INTO vedernikoff_src VALUES
  (1, 'shared term alpha info', 'dept red color'),
  (2, 'shared term beta info', 'dept blue color'),
  (3, 'shared term gamma info', 'dept red color'),
  (4, 'shared term delta info', 'dept blue color'),
  (5, 'shared term epsilon info', 'dept red color');

statement count 5
COPY vedernikoff_src TO '/tmp/${__DATABASE__}_vedernikoff.jsonl' (FORMAT json);

statement ok
CREATE VIEW vedernikoff_ext AS
  SELECT * FROM read_json('/tmp/${__DATABASE__}_vedernikoff.jsonl');

statement ok
CREATE INDEX vedernikoff_idx ON vedernikoff_ext USING inverted(a, b test_english, c test_english);

query
SELECT a, b FROM vedernikoff_idx WHERE b @@ ts_phrase('shared term') ORDER BY a;
----
a	b
1	shared term alpha info
2	shared term beta info
3	shared term gamma info
4	shared term delta info
5	shared term epsilon info

query
SELECT a, b, c FROM vedernikoff_idx WHERE b @@ ts_phrase('info') ORDER BY a;
----
a	b	c
1	shared term alpha info	dept red color
2	shared term beta info	dept blue color
3	shared term gamma info	dept red color
4	shared term delta info	dept blue color
5	shared term epsilon info	dept red color

query
SELECT a, c FROM vedernikoff_idx WHERE c @@ ts_phrase('dept red color') ORDER BY a;
----
a	c
1	dept red color
3	dept red color
5	dept red color

query
SELECT a, c FROM vedernikoff_idx WHERE c @@ ts_phrase('dept blue color') ORDER BY a;
----
a	c
2	dept blue color
4	dept blue color

statement ok
DROP VIEW vedernikoff_ext;

statement ok
DROP TABLE vedernikoff_src;


statement ok
CREATE TABLE dense_multi (a INTEGER PRIMARY KEY, b TEXT);

statement ok
INSERT INTO dense_multi VALUES
  (1, 'universal token alpha'),
  (2, 'universal token beta'),
  (3, 'universal token gamma'),
  (4, 'universal token delta');

statement ok
CREATE INDEX dense_multi_idx ON dense_multi USING inverted(a, b test_english);

statement ok
VACUUM (UPDATE_INDEXES) dense_multi;

statement ok
INSERT INTO dense_multi VALUES
  (5, 'universal token epsilon'),
  (6, 'universal token zeta'),
  (7, 'universal token eta'),
  (8, 'universal token theta');

statement ok
VACUUM (UPDATE_INDEXES) dense_multi;

query
SELECT a, b FROM dense_multi_idx WHERE b @@ ts_phrase('universal token') ORDER BY a;
----
a	b
1	universal token alpha
2	universal token beta
3	universal token gamma
4	universal token delta
5	universal token epsilon
6	universal token zeta
7	universal token eta
8	universal token theta

query
SELECT a, b FROM dense_multi_idx WHERE b @@ ts_phrase('gamma') OR b @@ ts_phrase('eta') ORDER BY a;
----
a	b
3	universal token gamma
7	universal token eta

query
SELECT a, BM25(dense_multi_idx.tableoid) > 0 AS has_score FROM dense_multi_idx WHERE b @@ ts_phrase('universal') ORDER BY a;
----
a	has_score
1	t
2	t
3	t
4	t
5	t
6	t
7	t
8	t

statement ok
INSERT INTO dense_multi VALUES
  (9, 'universal token iota'),
  (10, 'universal token kappa');

statement ok
VACUUM (UPDATE_INDEXES) dense_multi;

query
SELECT a, b FROM dense_multi_idx WHERE b @@ ts_phrase('universal token') ORDER BY a;
----
a	b
1	universal token alpha
2	universal token beta
3	universal token gamma
4	universal token delta
5	universal token epsilon
6	universal token zeta
7	universal token eta
8	universal token theta
9	universal token iota
10	universal token kappa

statement ok
DROP TABLE dense_multi;


# Inverted index with array columns: index on scalar fields, SELECT includes arrays

statement ok
CREATE TABLE arr_idx_tbl (a INTEGER PRIMARY KEY, b TEXT, nums INTEGER[], labels VARCHAR[]);

statement ok
INSERT INTO arr_idx_tbl VALUES
  (1, 'quick brown fox jumps', ARRAY[1, 2, 3], ARRAY['alpha', 'beta']),
  (2, 'lazy dog sleeps all day', ARRAY[4, 5], ARRAY['gamma']),
  (3, 'quick fox runs fast', ARRAY[1, 3], ARRAY['alpha', 'delta', 'epsilon']),
  (4, 'brown dog barks loudly', ARRAY[]::INTEGER[], ARRAY[]::VARCHAR[]);

# workaround for https://github.com/serenedb/serenedb/issues/530
statement ok
INSERT INTO arr_idx_tbl VALUES (5, 'silent owl watches', NULL, NULL);

statement ok
CREATE INDEX arr_idx_tbl_idx ON arr_idx_tbl USING inverted(a, b test_english);

query
SELECT a, b, nums, labels FROM arr_idx_tbl_idx WHERE b @@ ts_phrase('quick') ORDER BY a;
----
a	b	nums	labels
1	quick brown fox jumps	{1,2,3}	{alpha,beta}
3	quick fox runs fast	{1,3}	{alpha,delta,epsilon}

query
SELECT a, nums, labels FROM arr_idx_tbl_idx WHERE b @@ ts_phrase('dog') ORDER BY a;
----
a	nums	labels
2	{4,5}	{gamma}
4	{}	{}

query
SELECT a, labels FROM arr_idx_tbl_idx WHERE b @@ ts_phrase('fox') ORDER BY a;
----
a	labels
1	{alpha,beta}
3	{alpha,delta,epsilon}

query
SELECT a, nums, labels FROM arr_idx_tbl_idx WHERE b @@ ts_phrase('quick') OR b @@ ts_phrase('lazy') ORDER BY a;
----
a	nums	labels
1	{1,2,3}	{alpha,beta}
2	{4,5}	{gamma}
3	{1,3}	{alpha,delta,epsilon}

query
SELECT a, nums, labels FROM arr_idx_tbl_idx WHERE b @@ ts_phrase('owl') ORDER BY a;
----
a	nums	labels
5	NULL	NULL

statement ok
DROP TABLE arr_idx_tbl;


statement ok
CREATE TABLE no_pk_table AS
SELECT
  CASE
    WHEN ids.value % 2 = 0 THEN
      'word is good: ' || (ids.value)::text
    ELSE
      'word is bad: ' || (ids.value)::text
  END AS word
FROM
  generate_series(1, 1000) as ids(value)


statement ok
CREATE INDEX no_pk_index ON no_pk_table USING INVERTED(word test_english);


query
SELECT * FROM no_pk_index WHERE word @@ ts_phrase('bad') LIMIT 1;
----
word
word is bad: 1
