hash-threshold 100

statement ok
CREATE TABLE foo (a INTEGER PRIMARY KEY, b VARCHAR, c VARCHAR);

statement ok
INSERT INTO foo values (1, 'quick brown fox jumps over lazy dog', 'value a');

statement ok
CREATE TEXT SEARCH DICTIONARY test_english(
    template = 'text',
    locale = 'en_US.UTF-8',
    case = 'none',
    stemming = false,
    accent = false,
    frequency = true,
    position = true
);

statement ok
CREATE INDEX foo_idx ON foo USING inverted(a, b test_english, c test_english);

query
SELECT a, b, c FROM foo_idx WHERE PHRASE(b, 'over lazy dog');
----
a	b	c
1	quick brown fox jumps over lazy dog	value a

statement ok
INSERT INTO foo values (2, 'quick red fox jumps over lazy dog', 'value a');

statement ok
VACUUM (UPDATE_INDEXES) foo;

query
SELECT a, b FROM foo_idx WHERE PHRASE(b, 'over lazy dog') ORDER BY a;
----
a	b
1	quick brown fox jumps over lazy dog
2	quick red fox jumps over lazy dog

statement ok
UPDATE foo SET c = 'value abc' WHERE a = 1;

statement ok
VACUUM (UPDATE_INDEXES) foo;

query
SELECT a, b, c FROM foo_idx WHERE PHRASE(c, 'value abc') AND PHRASE(b, 'over lazy dog');
----
a	b	c
1	quick brown fox jumps over lazy dog	value abc

statement ok
INSERT INTO foo values (3, 'quick red fox jumps over big dog', 'value a');

statement ok
INSERT INTO foo values (4, 'quick brown fox jumps over big dog', 'value b');

statement ok
VACUUM (UPDATE_INDEXES) foo;

query
SELECT a, b FROM foo_idx WHERE PHRASE(b, 'over big dog') OR PHRASE(b, 'red fox') ORDER BY a;
----
a	b
2	quick red fox jumps over lazy dog
3	quick red fox jumps over big dog
4	quick brown fox jumps over big dog

query
SELECT a, b FROM foo_idx WHERE PHRASE(b, 'over big dog') OR a = 1 ORDER BY a;
----
a	b
1	quick brown fox jumps over lazy dog
3	quick red fox jumps over big dog
4	quick brown fox jumps over big dog

query
SELECT a, b, c FROM foo_idx WHERE PHRASE(c, 'value b') AND PHRASE(b, 'over big dog');
----
a	b	c
4	quick brown fox jumps over big dog	value b

statement ok
DROP TABLE foo;

control substitution on

statement ok
CREATE TABLE vedernikoff (a INTEGER PRIMARY KEY, b VARCHAR, c VARCHAR);

statement ok
INSERT INTO vedernikoff values (1, 'pudge goes mid every game', 'babsky');

statement ok
INSERT INTO vedernikoff values (2, 'anchin-chan reads manga all day', 'babsky');

statement ok
INSERT INTO vedernikoff values (3, 'anchin-chan watches anime at night', 'tuetue');

statement ok
INSERT INTO vedernikoff values (4, 'pudge goes bot every game', 'gayazov');

statement ok
CREATE INDEX vedernikoff_idx ON vedernikoff USING inverted(a, b test_english, c test_english);


query
SELECT COUNT(1) FROM vedernikoff_idx WHERE PHRASE(b, 'pudge') AND PHRASE(b, 'game');
----
count
2


query
EXPLAIN (EXECUTION) SELECT COUNT(*) FROM vedernikoff_idx WHERE PHRASE(b, 'pudge') AND PHRASE(b, 'game');
----
QUERY PLAN
EXECUTION PLAN:
Fragment 0:  numWorkers=0:
-- Aggregation[1][SINGLE count := presto_count()] -> "count":BIGINT
  -- TableScan[0][vedernikoff, type=search_lookup, filter=AND[PHRASE[b(string) = <Term:pudge(0, 0); >] && PHRASE[b(string) = <Term:game(0, 0); >]]] ->


query
SELECT a, b FROM vedernikoff_idx WHERE PHRASE(b, 'every game') OR PHRASE(b, 'anchin-chan') ORDER BY a;
----
a	b
1	pudge goes mid every game
2	anchin-chan reads manga all day
3	anchin-chan watches anime at night
4	pudge goes bot every game

query
SELECT a, b FROM vedernikoff_idx WHERE PHRASE(b, 'every game') OR a = 2 ORDER BY a;
----
a	b
1	pudge goes mid every game
2	anchin-chan reads manga all day
4	pudge goes bot every game

query
SELECT a, b, c FROM vedernikoff_idx WHERE PHRASE(c, 'gayazov') AND PHRASE(b, 'every game');
----
a	b	c
4	pudge goes bot every game	gayazov


statement ok
UPDATE vedernikoff SET c = 'deadinside' WHERE a = 3;

statement ok
VACUUM (UPDATE_INDEXES) vedernikoff;

query
SELECT a, b, c FROM vedernikoff_idx WHERE PHRASE(c, 'deadinside') AND PHRASE(b, 'watches anime');
----
a	b	c
3	anchin-chan watches anime at night	deadinside

statement ok
DROP TABLE vedernikoff;

statement ok
CREATE TABLE biksalen_memes (a INTEGER PRIMARY KEY, b TEXT, c TEXT);

statement ok
INSERT INTO biksalen_memes VALUES
  (1, 'pudge goes mid every game', 'clickclack university'),
  (2, 'anchin-chan reads manga all day', 'clickclack university'),
  (3, 'vedernikoff carries team again', 'deadinside academy');

query
CREATE INDEX donsimon_idx ON biksalen_memes USING inverted(b, c) WITH (EXPLAIN = 'logical');
----
QUERY PLAN
LOGICAL PLAN:
- TableWrite INSERT: -> ROW<rows:BIGINT>
    a := a
    b := b
    c := c
  - TableScan: biksalen_memes -> ROW<"a":INTEGER,"b":VARCHAR,"c":VARCHAR>

query
CREATE INDEX donsimon_idx ON biksalen_memes USING inverted(b, c) WITH (EXPLAIN = 'execution');
----
QUERY PLAN
EXECUTION PLAN:
Fragment 0:  numWorkers=0:
-- TableWrite[1][serenedb(table=biksalen_memes, kind=INSERT)] -> rows:BIGINT
  -- TableScan[0][biksalen_memes, type=rocksdb_full_scan] -> "a":INTEGER, "b":VARCHAR, "c":VARCHAR

query
CREATE INDEX donsimon_idx ON biksalen_memes USING inverted(b, c) WITH (EXPLAIN = 'logical', EXPLAIN = 'execution');
----
QUERY PLAN
LOGICAL PLAN:
- TableWrite INSERT: -> ROW<rows:BIGINT>
    a := a
    b := b
    c := c
  - TableScan: biksalen_memes -> ROW<"a":INTEGER,"b":VARCHAR,"c":VARCHAR>
EXECUTION PLAN:
Fragment 0:  numWorkers=0:
-- TableWrite[1][serenedb(table=biksalen_memes, kind=INSERT)] -> rows:BIGINT
  -- TableScan[0][biksalen_memes, type=rocksdb_full_scan] -> "a":INTEGER, "b":VARCHAR, "c":VARCHAR

query
CREATE INDEX donsimon_idx ON biksalen_memes USING inverted(b test_english, c test_english) WITH (EXPLAIN = analyze);
----
QUERY PLAN
EXECUTION PLAN WITH STATS:
Fragment 0:  numWorkers=0:
-- TableWrite[1][serenedb(table=biksalen_memes, kind=INSERT)] -> rows:BIGINT
   Output: 1 rows (8B, 1 batches), Cpu time: <slt:ignore>, Wall time: <slt:ignore>, Blocked wall time: 0ns, Peak memory: 0B, Memory allocations: 0, Threads: 1, CPU breakdown: B/I/O/F (<slt:ignore>)
  -- TableScan[0][biksalen_memes, type=rocksdb_full_scan] -> "a":INTEGER, "b":VARCHAR, "c":VARCHAR
     Input: 3 rows (<slt:ignore>, 1 batches), Output: 3 rows (<slt:ignore>, 1 batches), Cpu time: <slt:ignore>, Wall time: <slt:ignore>, Blocked wall time: 0ns, Peak memory: <slt:ignore>, Memory allocations: <slt:ignore>, Threads: 1, Splits: 1, CPU breakdown: B/I/O/F (<slt:ignore>)

# EXPLAIN ANALYZE must actually create the index
query
SELECT a, b FROM donsimon_idx WHERE PHRASE(b, 'every game') ORDER BY a;
----
a	b
1	pudge goes mid every game

query
SELECT a, b, c FROM donsimon_idx WHERE PHRASE(c, 'clickclack university') ORDER BY a;
----
a	b	c
1	pudge goes mid every game	clickclack university
2	anchin-chan reads manga all day	clickclack university

query
SELECT a, b, c FROM donsimon_idx WHERE PHRASE(c, 'deadinside academy') AND PHRASE(b, 'vedernikoff') ORDER BY a;
----
a	b	c
3	vedernikoff carries team again	deadinside academy

query
SELECT a, b FROM donsimon_idx WHERE PHRASE(b, 'every game') OR PHRASE(b, 'mass effect') ORDER BY a;
----
a	b
1	pudge goes mid every game

query
SELECT * FROM donsimon_idx;
----
a	b	c
1	pudge goes mid every game	clickclack university
2	anchin-chan reads manga all day	clickclack university
3	vedernikoff carries team again	deadinside academy



# index backfill from external (file) table

statement ok
CREATE TABLE babsky_src (a INTEGER PRIMARY KEY, b TEXT, c TEXT);

statement ok
INSERT INTO babsky_src VALUES
  (1, 'pudge goes mid every game', 'clickclack university'),
  (2, 'anchin-chan reads manga all day', 'clickclack university'),
  (3, 'vedernikoff carries team again', 'deadinside academy'),
  (4, 'gayazov plays mass effect', 'deadinside academy'),
  (5, 'krivda writes sql at night', 'clickclack university');

statement count 5
COPY babsky_src TO '/tmp/${__DATABASE__}_babsky_memes.parquet' (FORMAT PARQUET);

statement ok
CREATE TABLE babsky_ext(
  a INT8,
  b TEXT,
  c TEXT
) USING EXTERNAL
WITH (
  PATH = '/tmp/${__DATABASE__}_babsky_memes.parquet'
);

statement ok
CREATE INDEX babsky_ext_idx ON babsky_ext USING inverted(a, b test_english, c test_english);

query
SELECT a, b FROM babsky_ext_idx WHERE PHRASE(b, 'pudge goes') ORDER BY a;
----
a	b
1	pudge goes mid every game

query
SELECT a, b FROM babsky_ext_idx WHERE PHRASE(b, 'anchin-chan') ORDER BY a;
----
a	b
2	anchin-chan reads manga all day

query
SELECT a, b, c FROM babsky_ext_idx WHERE PHRASE(c, 'clickclack university') ORDER BY a;
----
a	b	c
1	pudge goes mid every game	clickclack university
2	anchin-chan reads manga all day	clickclack university
5	krivda writes sql at night	clickclack university

query
SELECT a, b, c FROM babsky_ext_idx WHERE PHRASE(c, 'deadinside academy') AND PHRASE(b, 'vedernikoff') ORDER BY a;
----
a	b	c
3	vedernikoff carries team again	deadinside academy

query
SELECT a, b FROM babsky_ext_idx WHERE PHRASE(b, 'every game') OR PHRASE(b, 'mass effect') ORDER BY a;
----
a	b
1	pudge goes mid every game
4	gayazov plays mass effect

query
SELECT * FROM babsky_ext_idx;
----
a	b	c
1	pudge goes mid every game	clickclack university
2	anchin-chan reads manga all day	clickclack university
3	vedernikoff carries team again	deadinside academy
4	gayazov plays mass effect	deadinside academy
5	krivda writes sql at night	clickclack university

statement ok
DROP TABLE babsky_ext;

statement ok
DROP TABLE babsky_src;


# index backfill from external (text/csv) table

statement ok
CREATE TABLE text_idx_src (a INTEGER PRIMARY KEY, b TEXT, c TEXT);

statement ok
INSERT INTO text_idx_src VALUES
  (1, 'pudge goes mid every game', 'clickclack university'),
  (2, 'anchin-chan reads manga all day', 'clickclack university'),
  (3, 'vedernikoff carries team again', 'deadinside academy'),
  (4, 'gayazov plays mass effect', 'deadinside academy'),
  (5, 'krivda writes sql at night', 'clickclack university');

statement count 5
COPY text_idx_src TO '/tmp/${__DATABASE__}_text_idx_memes.csv';

statement ok
CREATE TABLE text_idx_ext(
  a INT8,
  b TEXT,
  c TEXT
) USING EXTERNAL
WITH (
  PATH = '/tmp/${__DATABASE__}_text_idx_memes.csv'
);

statement ok
CREATE INDEX text_idx_ext_idx ON text_idx_ext USING inverted(a, b test_english, c test_english);

query
SELECT a, b FROM text_idx_ext_idx WHERE PHRASE(b, 'pudge goes') ORDER BY a;
----
a	b
1	pudge goes mid every game

query
SELECT a, b FROM text_idx_ext_idx WHERE PHRASE(b, 'anchin-chan') ORDER BY a;
----
a	b
2	anchin-chan reads manga all day

query
SELECT a, b, c FROM text_idx_ext_idx WHERE PHRASE(c, 'clickclack university') ORDER BY a;
----
a	b	c
1	pudge goes mid every game	clickclack university
2	anchin-chan reads manga all day	clickclack university
5	krivda writes sql at night	clickclack university

query
SELECT a, b, c FROM text_idx_ext_idx WHERE PHRASE(c, 'deadinside academy') AND PHRASE(b, 'vedernikoff') ORDER BY a;
----
a	b	c
3	vedernikoff carries team again	deadinside academy

query
SELECT a, b FROM text_idx_ext_idx WHERE PHRASE(b, 'every game') OR PHRASE(b, 'mass effect') ORDER BY a;
----
a	b
1	pudge goes mid every game
4	gayazov plays mass effect

query
SELECT * FROM text_idx_ext_idx;
----
a	b	c
1	pudge goes mid every game	clickclack university
2	anchin-chan reads manga all day	clickclack university
3	vedernikoff carries team again	deadinside academy
4	gayazov plays mass effect	deadinside academy
5	krivda writes sql at night	clickclack university

statement ok
DROP TABLE text_idx_ext;

statement ok
DROP TABLE text_idx_src;


# BM25 scoring on external (parquet) table

statement ok
CREATE TABLE score_parquet_src (a INTEGER PRIMARY KEY, b TEXT);

statement ok
INSERT INTO score_parquet_src VALUES
  (1, 'the quick brown fox jumps over the lazy dog'),
  (2, 'the quick fox'),
  (3, 'the lazy dog');

statement count 3
COPY score_parquet_src TO '/tmp/${__DATABASE__}_score_parquet.parquet' (FORMAT PARQUET);

statement ok
CREATE TABLE score_parquet_ext(
  a INT8,
  b TEXT
) USING EXTERNAL
WITH (
  PATH = '/tmp/${__DATABASE__}_score_parquet.parquet'
);

statement ok
CREATE TEXT SEARCH DICTIONARY score_en(
    template = 'text',
    locale = 'en_US.UTF-8',
    case = 'none',
    stemming = false,
    accent = false,
    frequency = true,
    position = true,
    norm = true
);

statement ok
CREATE INDEX score_parquet_idx ON score_parquet_ext USING inverted(a, b score_en);

query
SELECT a, BM25() > 0 AS has_score FROM score_parquet_idx WHERE PHRASE(b, 'fox') ORDER BY a;
----
a	has_score
1	t
2	t

query
SELECT a FROM score_parquet_idx WHERE PHRASE(b, 'fox') ORDER BY BM25() DESC, a;
----
a
1
2

statement ok
DROP TABLE score_parquet_ext;

statement ok
DROP TABLE score_parquet_src;


# BM25 scoring on external (text/csv) table

statement ok
CREATE TABLE score_text_src (a INTEGER PRIMARY KEY, b TEXT);

statement ok
INSERT INTO score_text_src VALUES
  (1, 'the quick brown fox jumps over the lazy dog'),
  (2, 'the quick fox'),
  (3, 'the lazy dog');

statement count 3
COPY score_text_src TO '/tmp/${__DATABASE__}_score_text.csv';

statement ok
CREATE TABLE score_text_ext(
  a INT8,
  b TEXT
) USING EXTERNAL
WITH (
  PATH = '/tmp/${__DATABASE__}_score_text.csv'
);

statement ok
CREATE INDEX score_text_idx ON score_text_ext USING inverted(a, b score_en);

query
SELECT a, BM25() > 0 AS has_score FROM score_text_idx WHERE PHRASE(b, 'fox') ORDER BY a;
----
a	has_score
1	t
2	t

query
SELECT a FROM score_text_idx WHERE PHRASE(b, 'fox') ORDER BY BM25() DESC, a;
----
a
1
2

statement ok
DROP TABLE score_text_ext;

statement ok
DROP TABLE score_text_src;


# Multi-segment scoring: insert+vacuum then insert again (unsorted keys across segments)

statement ok
CREATE TABLE multi_seg (a INTEGER PRIMARY KEY, b TEXT);

statement ok
INSERT INTO multi_seg VALUES (1, 'alpha fox'), (2, 'beta fox');

statement ok
CREATE INDEX multi_seg_idx ON multi_seg USING inverted(a, b score_en);

statement ok
VACUUM (UPDATE_INDEXES) multi_seg;

statement ok
INSERT INTO multi_seg VALUES (3, 'gamma fox'), (4, 'delta fox');

statement ok
VACUUM (UPDATE_INDEXES) multi_seg;

query
SELECT a, BM25() > 0 AS has_score FROM multi_seg_idx WHERE PHRASE(b, 'fox') ORDER BY a;
----
a	has_score
1	t
2	t
3	t
4	t

query
SELECT a FROM multi_seg_idx WHERE PHRASE(b, 'fox') ORDER BY BM25() DESC, a;
----
a
1
2
3
4

statement ok
DROP TABLE multi_seg;
